,Brand,Product_Name,Price,Category
447,CALVIN KLEIN 205W39NYC,"""Jaws"" Denim Button-Front Shirt",$990,Shirts
448,Thom Browne,Cotton Oxford Cloth Shirt,$370,Shirts
449,Jil Sander,Boxy Jacket,"$1,250",Shirts
450,Saint Laurent,Check Wool-Blend Gauze Oversized Shirt,$890,Shirts
451,Maison Margiela,Striped Raw-Edge Cotton Poplin Shirt,$595,Shirts
452,Ermenegildo Zegna,Bengal-Striped Cotton Poplin Dress Shirt,$415,Shirts
453,Givenchy,Logo Flame Georgette Bowling Shirt,$695,Shirts
454,HECHO,Thread-Braided Slub Linen Shirt,$340,Shirts
455,Isaia,Cotton Piqué Shirt,$350,Shirts
456,Prada,Stretch-Cotton Poplin Shirt,$520,Shirts
457,Isabel Marant,Bucket Bandana-Print Cotton Voile Shirt,$325,Shirts
458,Thom Browne,Appliquéd Cotton Button-Down Shirt,$450,Shirts
459,Balenciaga,Logo-Back Denim Shirt,$913,Shirts
460,Isabel Marant,Billy Plaid Cotton Flannel Shirt,$445,Shirts
461,Cifonelli,Cotton-Linen Shirt,$450,Shirts
462,Gucci,Embroidered Cotton Bowling Shirt,"$1,280",Shirts
463,AMIRI,Palm-Tree-Print Military Shirt,$750,Shirts
464,Ermenegildo Zegna,Striped Cotton Dress Shirt,$395,Shirts
465,PS by Paul Smith,Plaid Cotton Flannel Button-Down Shirt,$195,Shirts
466,Jil Sander,Patch-Pocket Cotton Poplin Shirt,$470,Shirts
467,RRL,Patchwork Cotton Flannel Workshirt,$165,Shirts
468,Paul Smith,Cotton-Blend Poplin Dress Shirt,$250,Shirts
469,424,Denim Oversized Work Shirt,$475,Shirts
470,Kenzo,Tiger-Embroidered Linen-Cotton Shirt,$170,Shirts
471,Theory,Sylvain Shirt,$195,Shirts
472,RRL,Sherman Plaid Cotton Popover Shirt,$240,Shirts
473,Brioni,Checked Cotton Dress Shirt,$520,Shirts
474,Isaia,Cotton Piqué Shirt,$650,Shirts
475,Balenciaga,Logo-Back Plaid Boxy Shirt,$810,Shirts
476,424,Plaid Silk Chiffon Oversized Shirt,$625,Shirts
477,Isaia,Cotton Piqué Shirt,$350,Shirts
478,Burberry,Necktie-Detailed Striped Cotton Shirt,$580,Shirts
479,Finamore,Cotton Chambray Dress Shirt,$425,Shirts
480,Ermenegildo Zegna,Centoquaranta Plaid Cotton Poplin Shirt,$475,Shirts
481,Loro Piana,Houndstooth-Print Cotton Jersey Shirt,$715,Shirts
482,Isaia,Button-Front Shirt,$745,Shirts
483,Prada,Striped Floral Bowling Shirt,"$1,030",Shirts
484,Paul Smith,Crystal-Print Cotton Poplin Shirt,$295,Shirts
485,Neil Barrett,Piercing-Detailed Cotton Flannel Shirt,$515,Shirts
486,Ovadia & Sons,Motorcycle-Print Cotton Poplin Shirt,$270,Shirts
487,Dries Van Noten,Wave-Print Cotton-Blend Button-Down Shirt,$690,Shirts
488,Sartorio,Striped Cotton Button-Down Shirt,$395,Shirts
489,Lanvin,Plaid Cotton Shirt,$695,Shirts
490,Brioni,Micro-Checked Cotton Poplin Dress Shirt,$630,Shirts
491,Ksubi,Pseudo Romantic Twill Shirt,$170,Shirts
492,Paul Smith,Floral Cotton Poplin Shirt,$295,Shirts
493,Barba,Cotton Chambray Shirt,$350,Shirts
494,Comme des Garçons PLAY,Heart Striped Cotton Shirt,$285,Shirts
495,Boglioli,Striped Cotton Dress Shirt,$295,Shirts
496,Hartford,Paul Herringbone-Weave Cotton Shirt,$215,Shirts
497,Haider Ackermann,Cotton Poplin Slim Shirt,$556,Shirts
498,Valentino,Logo-Print Cotton Poplin Camp Collar Shirt,$750,Shirts
499,Eidos,Floral Cotton Poplin Shirt,$250,Shirts
500,Lanvin,Colorblocked Sateen Bowling Shirt,$750,Shirts
501,Prada,Cotton-Blend Poplin Slim Shirt,$510,Shirts
502,Ovadia & Sons,Appliquéd Patchwork Plaid Flannel Shirt,$295,Shirts
503,Luciano Barbera,Geometric Woven Linen Sport Shirt,$375,Shirts
504,John Varvatos,Floral Cotton Jacquard Shirt,$228,Shirts
505,Valentino,Cotton Poplin Camp-Collar Shirt,$695,Shirts
506,Eidos,Striped Linen-Blend Crewneck Sweater,$395,Shirts
507,Givenchy,Logo Georgette Shirt,$980,Shirts
508,Boglioli,Mini-Houndstooth Cotton Poplin Dress Shirt,$345,Shirts
509,Officine Générale,Puckered Herringbone Cotton-Blend Shirt,$295,Shirts
510,Brioni,Striped Cotton Poplin Dress Shirt,$695,Shirts
511,Isabel Marant,Eggy Polished Voile Shirt,$475,Shirts
512,Barneys New York,Striped Slub Cotton Shirt,$285,Shirts
513,Fairfax,Micro-Houndstooth Cotton Dress Shirt,$295,Shirts
514,Vetements,Witch-Print Cotton Oversized Shirt,$880,Shirts
515,Barneys New York,Geometric-Print Camp Shirt,$165,Shirts
516,PS by Paul Smith,Floral Cotton Poplin Shirt,$195,Shirts
517,Barneys New York,Paisley Cotton Poplin Button-Down Shirt,$195,Shirts
518,Barba,Cotton Oxford Shirt,$350,Shirts
519,Raf Simons,Plaid Organza & Graphic Cotton 2-In-1 Shirt,"$1,375",Shirts
520,Fairfax,Herringbone Cotton-Wool Dress Shirt,$295,Shirts
521,R13,Hawaiian Floral Camp Shirt,$395,Shirts
522,CALVIN KLEIN 205W39NYC,Landscape-Photo-Print Cotton Poplin Oversized Shirt,$690,Shirts
523,Saint Laurent,Plaid Cotton Flannel Oversized Western Shirt,$750,Shirts
524,PS by Paul Smith,Striped Camp Shirt,$175,Shirts
525,Dries Van Noten,Colorblocked Cotton Poplin Shirt,$420,Shirts
526,Hartford,Cotton Twill Shirt,$235,Shirts
527,Comme des Garçons SHIRT,Graphic Cotton Shirt,$650,Shirts
528,Paul Smith,People-Print Cotton Poplin Shirt,$295,Shirts
529,VisVim,Piqué Cotton Elbow-Patch Shirt,$530,Shirts
530,Saint Laurent,Graphic Silk Crêpe De Chine Shirt,$990,Shirts
531,Sartorio,Cotton Button-Down Dress Shirt,$395,Shirts
532,Ermenegildo Zegna,Cotton Poplin Shirt,$375,Shirts
533,JACQUEMUS,Striped Cotton Folded-Pocket Oversized Shirt,$355,Shirts
534,Sies Marjan,Striped Cotton-Blend Oversized Shirt,$595,Shirts
535,Isaia,Checked Cotton Poplin Dress Shirt,$495,Shirts
536,Officine Générale,Selvedge-Detailed Cotton Oxford Shirt,$290,Shirts
537,Barneys New York,Slub Cotton-Linen Button-Down Shirt,$195,Shirts
538,Hartford,Cotton Flannel Shirt,$265,Shirts
539,Balenciaga,Logo-Back Denim Boxy Shirt,$810,Shirts
540,Fioroni,Cashmere-Silk Knit Shirt,"$1,195",Shirts
541,Saint Laurent,Logo-Embroidered Cotton Western Shirt,$890,Shirts
542,Cifonelli,Striped Cotton Poplin Dress Shirt,$425,Shirts
543,Alex Mill,Cotton Button-Front Shirt,$95,Shirts
544,Rag & Bone,Beck Cotton Corduroy Western Shirt,$295,Shirts
545,R13,Plaid Cotton Flannel Shirt,$395,Shirts
546,Dries Van Noten,Claver Cotton Shirt,$275,Shirts
547,Cifonelli,Cotton Chambray Dress Shirt,$425,Shirts
548,Off-White c/o Virgil Abloh,Cotton-Blend Flannel Shirt,$655,Shirts
549,Balenciaga,Plaid Cotton Flannel Hooded Shirt,$850,Shirts
550,AMIRI,Plaid Cotton-Blend Shirt,$625,Shirts
551,Rag & Bone,Checked Cotton Flannel Fit 3 Shirt,$225,Shirts
552,Off-White c/o Virgil Abloh,Checked Cotton-Blend Shirt,$620,Shirts
553,Hartford,Garment-Dyed Cotton Shirt,$235,Shirts
554,Givenchy,Flaming-Arrow-Embroidered Cotton Shirt,$780,Shirts
555,Prada,Stretch Cotton-Blend Poplin Slim Shirt,$510,Shirts
556,Balenciaga,Cotton Oxford Button-Down Shirt,$650,Shirts
557,Thom Browne,Oxford Cloth Shirt,$425,Shirts
558,Hartford,Garment-Dyed Cotton Shirt,$235,Shirts
559,Gucci,Paramount Plaid Cotton Flannel Shirt,"$1,380",Shirts
560,Theory,Sylvain Shirt,$195,Shirts
561,Balmain,Sunset & Palm Tree Cotton Shirt,$950,Shirts
562,PS by Paul Smith,Pin-Print Cotton Poplin Shirt,$195,Shirts
563,John Varvatos,Pick-Stitched Shirt,$198,Shirts
564,Alex Mill,Cotton Poplin Button-Front Shirt,$95,Shirts
565,Kiton,Herringbone Wool Shirt,"$1,150",Shirts
566,Barneys New York,Cotton Piqué Shirt,$89,Shirts
567,Dries Van Noten,Satin Western Shirt,"$1,100",Shirts
568,AMIRI,Palm-Tree- & Leopard-Print Silk Twill Shirt,$850,Shirts
569,John Varvatos Star U.S.A.,Lion & Floral Cotton Poplin Short-Sleeve Shirt,$98,Shirts
570,CMMN SWDN,Oversized Lamé Shirt,$415,Shirts
571,Dries Van Noten,Geometric-Print Sateen Bowling Shirt,$500,Shirts
572,RHUDE,Bandana-Print Cotton Shirt,$595,Shirts
573,Saint Laurent,Leopard-Print Silk Chiffon Shirt,"$1,990",Shirts
574,CMMN SWDN,Dexter Gauze Button-Front Short-Sleeve Shirt,$320,Shirts
575,Officine Générale,Floral Short-Sleeve Shirt,$295,Shirts
576,Ralph Lauren Purple Label,Washed Denim Western Shirt,$495,Shirts
577,Gucci,Anime-Print Silk Bowling Shirt,"$1,450",Shirts
578,Orlebar Brown,Mortan Linen Shirt,$245,Shirts
579,Saturdays NYC,Peony-Print Twill Camp Shirt,$195,Shirts
580,Dries Van Noten,Swirl-Print Satin Wrap Shirt,$810,Shirts
581,Barneys New York,Cotton Seersucker Shirt,$255,Shirts
582,Greg Lauren,Checked Cotton Flannel Studio Shirt,$915,Shirts
583,Fendi,Eye-Embroidered Cotton Poplin Shirt,$490,Shirts
584,Comme des Garçons,Oversized Satin Shirt,$315,Shirts
585,Boglioli,Prince Of Wales-Checked Cotton Poplin Dress Shirt,$345,Shirts
586,Balenciaga,Playing-Card Crêpe De Chine Shirt,"$1,290",Shirts
587,Giorgio Armani,Cotton-Blend Poplin Shirt,$445,Shirts
588,Alex Mill,Cotton Poplin Shirt,$95,Shirts
589,Saturdays NYC,Pinstriped Cotton Poplin Camp Shirt,$180,Shirts
590,Rag & Bone,Yokohama Checked Cotton Shirt,$250,Shirts
591,Dries Van Noten,Mesh Polo Shirt,$725,Shirts
592,James Perse,Cotton Terry Long-Sleeve Polo Shirt,$225,Shirts
593,R13,Cotton Flannel Shredded Seam Shirt,$395,Shirts
594,Balenciaga,Denim Layered-Look Shirt,$895,Shirts
595,Isaia,Leuca Cotton Twill Shirt,$425,Shirts
596,Ksubi,Scribble Camp-Collar Twill Shirt,$160,Shirts
597,Greg Lauren,Plaid Cotton Flannel Studio Shirt,$715,Shirts
598,Saturdays NYC,Canty Orchid-Print Camp Shirt,$175,Shirts
599,Isaia,Plaid Cotton Poplin Shirt,$445,Shirts
600,Barneys New York,Checked Cotton Flannel Shirt,$285,Shirts
601,Massimo Alba,Cotton-Cashmere Polo Shirt,$350,Shirts
602,Thom Browne,Cotton Oxford Cloth Button-Down Shirt,$390,Shirts
603,Lanvin,Micro-Jacquard Cotton Dress Shirt,$450,Shirts
604,Fendi,FF Logo-Print Shirt,$750,Shirts
605,P. Johnson,Cotton Twill Shirt,$250,Shirts
606,Dries Van Noten,Striped Shirt,$365,Shirts
607,Paul Smith,Pleated-Bib Cotton Tuxedo Shirt,$350,Shirts
608,Brunello Cucinelli,Oxford-Cloth Shirt,$495,Shirts
609,Comme des Garçons PLAY,Heart Cotton Poplin Shirt,$230,Shirts
610,John Varvatos,Grid-Checked Cotton Shirt,$198,Shirts
611,Bolzonella 1934,Cotton Chambray Shirt,$295,Shirts
612,Isaia,Checked Cotton Poplin Shirt,$445,Shirts
613,Orlebar Brown,Morton Slub Linen Shirt,$245,Shirts
614,Kiton,Houndstooth Wool-Silk Shirt Jacket,"$1,150",Shirts
615,Prabal Gurung,Cotton Poplin Long Wrap Shirt,$795,Shirts
616,Hartford,Washed Linen Shirt,$215,Shirts
617,RRL,Jack Rabbit Cotton Chambray Shirt,$225,Shirts
618,James Perse,Solid Poplin Shirt,$325,Shirts
619,Z Zegna,Polka Dot Herringbone-Weave Cotton Shirt,$245,Shirts
620,Thom Browne,Appliquéd Cotton Button-Down Shirt,$450,Shirts
621,Isabel Marant,Vigo Corduroy Western Shirt,$395,Shirts
622,Massimo Alba,Cotton Chambray Shirt,$305,Shirts
623,Raf Simons,Patch-Detailed Denim Oversized Shirt,$895,Shirts
624,Boglioli,Cotton Corduroy Dress Shirt,$375,Shirts
625,Marni,Plaid Silky Twill Oversized Button-Front Shirt,$950,Shirts
626,Saturdays NYC,Nico Broad-Striped Twill Shirt,$150,Shirts
627,Prada,Ruffle-Trimmed Tech-Jersey Shirt,$690,Shirts
628,John Varvatos,Abstract-Print Cotton Poplin Shirt,$248,Shirts
629,Brioni,Cotton Chambray Shirt,$500,Shirts
630,Paul Smith,Cotton-Blend Poplin Dress Shirt,$250,Shirts
631,AMIRI,"""Forever"" Dégradé-Plaid Cotton Flannel Shirt",$690,Shirts
632,Sies Marjan,Teun Cotton-Silk Boxy Shirt,$395,Shirts
633,Comme des Garçons PLAY,Heart Cotton Poplin Shirt,$230,Shirts
634,RHUDE,"""Powered By Dreams"" Camp Shirt",$595,Shirts
635,HECHO,Textured-Ribbed Silk-Linen Shirt,$355,Shirts
636,Officine Générale,Plaid Cotton Shirt,$320,Shirts
637,Dries Van Noten,Striped Twill Bowling Shirt,$460,Shirts
638,Comme des Garçons SHIRT,Graphic Cotton Shirt,$600,Shirts
639,LANDLORD,"""I Am Royal"" Colorblocked Tech-Faille Shirt",$850,Shirts
640,Ralph Lauren Purple Label,Cotton Flannel Shirt,$495,Shirts
641,Piattelli,Cotton Poplin Dress Shirt,$119,Shirts
642,P. Johnson,Cotton Oxford Button-Down Shirt,$250,Shirts
643,Kiton,Gingham Cotton Poplin Dress Shirt,$795,Shirts
644,Brioni,Slub Cotton Oxford Dress Shirt,$550,Shirts
645,Isaia,Button-Front Shirt,$745,Shirts
646,Vetements,Topstitched Cotton-Blend Oversized Workshirt,"$1,085",Shirts
647,Balenciaga,Logo-Print Denim Oversized Shirt,$950,Shirts
648,Helmut Lang,Silky Twill Camp Shirt,$370,Shirts
649,Saturdays NYC,Mateo Checked Shirt,$170,Shirts
650,Dries Van Noten,Wave-Print Cotton-Blend Bowling Shirt,$640,Shirts
651,Brunello Cucinelli,Chambray Shirt,$495,Shirts
652,Givenchy,Dragon-Sky-Print Silk Shirt,$980,Shirts
653,Madeworn,"""Nirvana""-Appliquéd Cotton Shirt Jacket",$750,Shirts
654,Theory,Irving Jigsaw-Print Cotton Shirt,$185,Shirts
655,Madeworn,"""Misfits""-Appliquéd Cotton Shirt Jacket",$750,Shirts
656,John Varvatos,Floral Cotton Jacquard Button-Front Shirt,$228,Shirts
657,P. Johnson,Brushed Cotton Button-Down Shirt,$325,Shirts
658,Prabal Gurung,Abstract-Floral Silk Twill Oversized Shirt,$825,Shirts
659,Dries Van Noten,Wave-Print Bowling Shirt,$545,Shirts
660,Cifonelli,Linen Guayabera Shirt,$395,Shirts
661,Barneys New York,Gingham Cotton Poplin Shirt,$265,Shirts
662,Napoleonerba,Slub Linen Shirt,$425,Shirts
663,Isaia,Twill Button-Front Shirt,$425,Shirts
664,The Row,Keith Silk Boxy Shirt,$950,Shirts
665,LOEWE,Faux-Leather-Patch Shirt,$450,Shirts
666,Eleventy,Cotton Chambray Shirt,$195,Shirts
667,PS by Paul Smith,Plaid Cotton-Linen Shirt,$175,Shirts
668,Thom Browne,Block-Striped Cotton Oxford Button-Down Shirt,$395,Shirts
669,Thom Browne,Oxford Cloth Shirt,$425,Shirts
670,Hartford,Cotton Corduroy Shirt,$225,Shirts
671,Theory,Sylvain Shirt,$195,Shirts
672,Warren Lotas,Barbed-Wire-Print Silk Oversized Shirt,$895,Shirts
673,Saint Laurent,Velvet-Trimmed Silk Satin Shirt,$990,Shirts
674,Dries Van Noten,Wave-Embroidered Cotton Twill Shirt,$590,Shirts
675,Ermenegildo Zegna,Bengal-Striped Cotton Poplin Dress Shirt,$415,Shirts
676,Cifonelli,Checked Cotton Dress Shirt,$425,Shirts
677,Finamore,Pinstriped Cotton Dress Shirt,$395,Shirts
678,Craig Green,Harness-Detailed Cotton Shirt,$690,Shirts
679,Balenciaga,Striped Cotton-Blend Poplin Oversized Shirt,$750,Shirts
680,Gucci,GG-Logo Silk Jacquard Button-Front Shirt,"$1,400",Shirts
681,Eleventy,Cotton Poplin Shirt,$195,Shirts
682,JACQUEMUS,Oversized Cotton Shirt,$245,Shirts
683,Lanvin,Cotton Slim-Fit Dress Shirt,$380,Shirts
684,Boglioli,Denim-Effect Cotton Oxford Cloth Dress Shirt,$315,Shirts
685,Ermenegildo Zegna,Slub Cotton Shirt,$395,Shirts
686,Hartford,Brushed Cotton Flannel Shirt,$200,Shirts
687,AMIRI,"""Hollywood"" Dot-Print Twill Shirt",$790,Shirts
688,Officine Générale,Wool Zip-Front Shirt,$445,Shirts
689,Paul Smith,Underwear-Print Cotton Poplin Shirt,$295,Shirts
690,Cifonelli,Linen Guayabera Shirt,$395,Shirts
691,Comme des Garçons Homme,Contrast-Hem Striped Cotton Oxford Shirt,$545,Shirts
692,Barneys New York,Striped Cotton Poplin Dress Shirt,$265,Shirts
693,R13,Plaid Distressed Cotton Flannel Shirt,$395,Shirts
694,Ermenegildo Zegna,Striped Cotton Dress Shirt,$415,Shirts
695,Hartford,Cotton Corduroy Shirt,$225,Shirts
696,Comme des Garçons SHIRT,Graphic Cotton Shirt,$550,Shirts
697,Gucci,"Striped ""G"" Cotton Fil Coupé Shirt",$700,Shirts
698,PS by Paul Smith,Dot-Print Cotton Shirt,$175,Shirts
699,Piattelli,Striped Cotton-Linen Shirt,$89,Shirts
700,Hartford,Linen Button-Down Shirt,$215,Shirts
701,Gucci,Buckle & Web Striped Silk Oversized Shirt,"$1,400",Shirts
702,John Vizzone,Striped Cotton-Blend Poplin Dress Shirt,$195,Shirts
703,Officine Générale,Plaid Cotton Flannel Shirt,$295,Shirts
704,P. Johnson,Cotton Chambray Shirt,$245,Shirts
705,Gucci,Dancing-Pig Plaid Cotton Oversized Shirt,$780,Shirts
706,Lanvin,Cotton Poplin Dress Shirt,$450,Shirts
707,Marni,Striped Cotton Camp-Collar Shirt,$450,Shirts
708,Hartford,Cotton Flannel Shirt,$200,Shirts
709,Hartford,Plaid Flannel Shirt,$215,Shirts
710,CALVIN KLEIN 205W39NYC,Leather Military Shirt,"$1,900",Shirts
711,Prada,Cotton Poplin Dress Shirt,$520,Shirts
712,DICKIES CONSTRUCT,Logo Felt Workshirt,$280,Shirts
713,Hartford,Paul Cotton Flannel Shirt,$215,Shirts
714,DICKIES CONSTRUCT,Wool-Blend Oversized Workshirt,$260,Shirts
715,Luciano Barbera,Bengal-Striped Cotton Shirt,$425,Shirts
716,Off-White c/o Virgil Abloh,Checked Cotton-Blend Shirt,$620,Shirts
717,Sies Marjan,Relaxed Washed Satin Shirt,$595,Shirts
718,Brioni,Checked Cotton Poplin Dress Shirt,$575,Shirts
719,Barena Venezia,Virgin Wool Shirt,$455,Shirts
720,Balenciaga,Logo Cotton Poplin Shirt,$650,Shirts
721,Helmut Lang,Logo Cotton Poplin Shirt,$360,Shirts
722,Y/Project,Paisley Satin Oversized Camp Shirt,"$1,170",Shirts
723,Neil Barrett,Slim Polo Sweater,$790,Shirts
724,Eidos,Cotton Dress Shirt,$275,Shirts
725,P. Johnson,Brushed Cotton Button-Down Shirt,$325,Shirts
726,Comme des Garçons SHIRT,Graphic Cotton Shirt,$585,Shirts
727,The Row,Keith Silk-Cotton Boxy Shirt,$775,Shirts
728,mastermind JAPAN,Buffalo Plaid Cotton Flannel Shirt,"$1,695",Shirts
729,Hartford,Penn Plaid Flannel Shirt,$215,Shirts
730,Hartford,Cotton Oxford Cloth Shirt,$235,Shirts
731,JACQUEMUS,Sheaf-Print Cotton Voile Shirt,$340,Shirts
732,Barneys New York,Checked Cotton Dress Shirt,$245,Shirts
733,John Varvatos Star U.S.A.,Plaid Cotton Shirt,$128,Shirts
734,Barneys New York,Micro-Checked Cotton Poplin Dress Shirt,$265,Shirts
735,Barneys New York,Palm-Print Cotton Hawaiian Shirt,$145,Shirts
