,Brand,Product_Name,Price,Category
0,HECHO,Silk Organza Drawstring Shorts,$265,Shorts
1,Rick Owens,Tyrone Patchwork Denim Shorts,$780,Shorts
2,Satisfy,Paint-Splattered Compression Shorts,$435,Shorts
3,ATM Anthony Thomas Melillo,Striped Cotton French Terry Shorts,$225,Shorts
4,Greg Lauren,Mixed-Media Cotton Cargo Shorts,$750,Shorts
5,ATM Anthony Thomas Melillo,Cotton Piqué Drawstring Shorts,$125,Shorts
6,JACQUEMUS,Linen-Blend Canvas Painter Shorts,$375,Shorts
7,Just Don,Leopard-Inset Cotton-Blend Basketball Shorts,$575,Shorts
8,Officine Générale,Mosaic-Print Basket-Weave Drawstring Shorts,$265,Shorts
9,John Varvatos Star U.S.A.,Linen-Blend Flat-Front Shorts,$128,Shorts
10,Just Don,Tie-Dyed Silk Satin Basketball Shorts,$575,Shorts
11,John Varvatos Star U.S.A.,Linen-Blend Flat-Front Shorts,$128,Shorts
12,Just Don,Logo Satin Boxing Shorts,$575,Shorts
13,Thom Browne,Block-Striped Terry Sweatshorts,$690,Shorts
14,Kenzo,"""Médaillons"" Colorblocked Shorts",$240,Shorts
15,Prabal Gurung,Floral-Jacquard Gauze Basketball Shorts,$695,Shorts
16,Acne Studios,Rosso Cotton Cargo Shorts,$250,Shorts
17,Stone Island,Logo-Patch Cotton Drawstring Sweatshorts,$220,Shorts
18,Off-White c/o Virgil Abloh,"""Monalisa"" Cotton French Terry Shorts",$415,Shorts
19,OAMC,Logo Paint-Splatter-Print Cotton Shorts,$560,Shorts
20,Palm Angels,Tie-Dyed Cotton Sweatshorts,$475,Shorts
21,KATHARINE HAMNETT LONDON,Lucien Organic Cotton Drawstring Shorts,$170,Shorts
22,Rick Owens DRKSHDW,Cotton Ripstop Drop-Rise Shorts,$650,Shorts
23,Gucci,Logo Laminated-Tech-Jersey Shorts,"$1,380",Shorts
24,Rick Owens DRKSHDW,Cotton Drop-Rise Drawstring Shorts,$635,Shorts
25,Onia,Tom Slub Linen Cargo Shorts,$130,Shorts
26,JACQUEMUS,Button-Detailed Linen-Blend Shorts,$450,Shorts
27,Martine Rose,Long Motocross Shorts,"$1,080",Shorts
28,John Elliott,Tie-Dyed Mesh Basketball Shorts,$248,Shorts
29,Ovadia & Sons,"""Not Fade Away"" Tie-Dyed Sweatshorts",$250,Shorts
30,Ovadia & Sons,Belted Cotton Ripstop Cargo Shorts,$260,Shorts
31,FUMITO GANRYU,Tech-Fabric Drawstring Shorts,$570,Shorts
32,FILA,Lamotta Striped Velour Drawstring Shorts,$140,Shorts
33,Acne Studios,Richard Cotton Oversized Shorts,$240,Shorts
34,Alex Mill,Tropical-Camouflage Cotton Ripstop Shorts,$95,Shorts
35,Givenchy,Logo-Striped Denim Shorts,$640,Shorts
36,Gucci,GG-Jacquard Wool-Cotton Shorts,"$1,300",Shorts
37,Gucci,Embroidered Satin Basketball Shorts,$950,Shorts
38,ALYX,Logo Cotton-Blend Fleece Drawstring Shorts,$290,Shorts
39,LOEWE,Striped Slub Cotton Canvas Oversized Shorts,$790,Shorts
40,Stone Island XO Barneys New York,Ripstop Utility Shorts,$285,Shorts
41,Burberry,Striped Piqué Basketball Shorts,$450,Shorts
42,PURPLE,Dyed Distressed Denim Cutoff Shorts,$175,Shorts
43,Massimo Alba,Washed Linen-Cotton Canvas Shorts,$275,Shorts
44,Sacai,Cotton Corduroy Belted Shorts,$815,Shorts
45,Massimo Alba,Washed Linen-Cotton Canvas Shorts,$275,Shorts
46,Massimo Alba,Washed Linen-Cotton Canvas Shorts,$275,Shorts
47,John Elliott,Marble-Pattern Cotton Terry Drawstring Shorts,$248,Shorts
48,Sacai,Floral-Embroidered Cotton Corduroy Shorts,$905,Shorts
49,Off-White c/o Virgil Abloh,Logo Mesh Shorts,$355,Shorts
50,Gucci,Pleated Wool Hopsack Skort,"$1,200",Shorts
51,FRAME,L'Homme Distressed Denim Shorts,$185,Shorts
52,Gucci,Wool Hopsack Pleated-Front Shorts,$790,Shorts
53,Comme des Garçons,Fringed Wide-Leg Shorts,$920,Shorts
54,J.W.Anderson,Durer Scene Linen Hopsack Drawstring Shorts,$590,Shorts
55,AMIRI,Thrasher Distressed Denim Shorts,$550,Shorts
56,LOEWE,Bandana-Patchwork Cotton Poplin Drawstring Shorts,$890,Shorts
57,Marni,Cotton Long Shorts,$645,Shorts
58,Barneys New York,Torino Cotton Twill Cuffed Shorts,$250,Shorts
59,Barneys New York,Torino Cotton Twill Cuffed Shorts,$250,Shorts
60,Maison Margiela,Colorblocked Washed Tech-Taffeta Boxing Shorts,$470,Shorts
61,RtA,Cotton Twill Basketball Shorts,$215,Shorts
62,Officine Générale,Geometric-Floral Cotton Drawstring Shorts,$285,Shorts
63,John Varvatos Star U.S.A.,Ink Drop-Stained Cotton Flat-Front Shorts,$148,Shorts
64,Rick Owens,Pod Slub Taffeta Shorts,$760,Shorts
65,Sies Marjan,Elias Washed Satin Cargo Shorts,$595,Shorts
66,Prabal Gurung,Abstract-Floral Silk Twill Basketball Shorts,$595,Shorts
67,Prabal Gurung,Cotton Twill Shorts,$595,Shorts
68,Thom Browne,Striped Twill Shorts,$940,Shorts
69,Jil Sander,Wide-Leg Shorts,$790,Shorts
70,Off-White c/o Virgil Abloh,Logo Camouflage Cotton Terry Shorts,$450,Shorts
71,LANDLORD,Space Colony Colorblocked Tech-Twill Track Shorts,$550,Shorts
72,LANDLORD,Space Colony Tech-Faille Track Shorts,$550,Shorts
73,Sacai,Belted Bandanna-Print Pleated Shorts,$615,Shorts
74,Eleventy,Cotton Twill Belted Bermuda Shorts,$275,Shorts
75,PS by Paul Smith,Palm-Tree-Pattern Cotton-Blend Shorts,$195,Shorts
76,PS by Paul Smith,Sketch-Pattern Cotton Shorts,$195,Shorts
77,Eleventy,Cotton Twill Belted Bermuda Shorts,$275,Shorts
78,Dries Van Noten,Wave-Print Jersey Shorts,$550,Shorts
79,Dries Van Noten,Geometric-Print Sateen Shorts,$550,Shorts
80,Dries Van Noten,Wave-Print Cotton Twill Shorts,$460,Shorts
81,R13,Crossover Denim Shorts,$395,Shorts
82,R13,Crossover Plaid Wool Shorts,$545,Shorts
83,R13,Logo Cotton-Blend Terry Sweatshorts,$345,Shorts
84,R13,Ian Logo Distressed Denim Shorts,$465,Shorts
85,Theory,Noah Dot-Print Seersucker Shorts,$195,Shorts
86,Theory,Reverse Terry Drawstring Sweatshorts,$165,Shorts
87,Orlebar Brown,Harton Slub Linen Shorts,$245,Shorts
88,A-COLD-WALL*,Logo Tech-Twill Drawstring Shorts,$290,Shorts
89,Givenchy,Reflective-Detailed Cotton French Terry Shorts,$695,Shorts
90,adidas Originals by Alexander Wang,Photocopy Drawstring Shorts,$150,Shorts
91,Heron Preston,Logo Mesh Basketball Shorts,$380,Shorts
92,Heron Preston,Cotton French Terry Shorts,$340,Shorts
93,FiveSeventyFive,Velour Drawstring Shorts,$165,Shorts
94,Off-White c/o Virgil Abloh,Lake Mesh Shorts,$390,Shorts
95,Aztech Mountain,Sunny Side Elastic-Inset Twill Shorts,$395,Shorts
96,HECHO,Textured Silk-Linen Shorts,$345,Shorts
97,Officine Générale,Phil Worsted Wool Drawstring Shorts,$295,Shorts
98,Saturdays NYC,Keigo Striped Shorts,$150,Shorts
99,Off-White c/o Virgil Abloh,Mesh Shorts,$355,Shorts
100,AMIRI,Fleece Track Sweatshorts,$550,Shorts
101,James Perse,Y/osemite Jersey Drawstring Shorts,$125,Shorts
102,Givenchy,Logo-Embroidered Cotton Shorts,$845,Shorts
103,Vetements,Cotton-Blend Inside-Out Drop-Rise Shorts,$690,Shorts
104,Craig Green,Layered Cotton Drop-Rise Shorts,$690,Shorts
105,Wu Wear,Embroidered Cotton-Blend Velour Track Shorts,$98,Shorts
106,Wu Wear,Logo Tech-Faille Shorts,$98,Shorts
107,James Perse,Washed Cotton Poplin Surplus Shorts,$99,Shorts
108,Theory,Evan Striped Oxford Cloth Shorts,$175,Shorts
109,Gucci,Logo Tech-Twill Shorts,$850,Shorts
110,Barneys New York,Camouflage Linen-Cotton Shorts,$250,Shorts
111,Rick Owens DRKSHDW,Pod Cotton Fleece Drop-Rise Shorts,$615,Shorts
112,LOEWE,Trapunto-Stitched-Belt Leather Shorts,$890,Shorts
113,Rick Owens,Pod Leather Cargo Shorts,"$2,155",Shorts
