,Brand,Product_Name,Price,Category
0,Fioroni,Cotton Chambray Shirt,$350,Shirts
1,Barneys New York,Floral Cotton Dress Shirt,$265,Shirts
2,Rag & Bone,Fit 3 Plaid Cotton Flannel Shirt,$225,Shirts
3,AMIRI,Gradient Plaid Cotton-Blend Flannel Shirt,$650,Shirts
4,Boglioli,Slub-Weave Linen Shirt,$325,Shirts
5,Sartorio,Gingham Cotton Button-Down Shirt,$450,Shirts
6,Barba,Plaid Linen Shirt,$350,Shirts
7,Sartorio,Cotton Chambray Dress Shirt,$450,Shirts
8,Greg Lauren,Plaid Cotton Flannel Studio Shirt,$650,Shirts
9,Off-White c/o Virgil Abloh,"""Monalisa"" Checked Cotton-Blend Twill Shirt",$780,Shirts
10,Thom Browne,Block-Striped Cotton Chambray Shirt,$480,Shirts
11,Jil Sander,Photo-Print Shirt,$880,Shirts
12,Hartford,Linen Button-Down Shirt,$210,Shirts
13,Ermenegildo Zegna,Checked Linen-Cotton Shirt,$395,Shirts
14,Ermenegildo Zegna,Checked Linen-Cotton Shirt,$395,Shirts
15,Hartford,Linen Button-Down Shirt,$210,Shirts
16,Barba,Linen Linen Cavalry Twill Shirt,$350,Shirts
17,Sartorio,Hairline-Striped Cotton Button-Down Shirt,$450,Shirts
18,Officine Générale,Denim-Effect Button-Front Shirt,$265,Shirts
19,Hartford,Slub Linen Shirt,$210,Shirts
20,Just Don,Leopard Jacquard Button-Front Shirt,$650,Shirts
21,Kiton,Flamingo-Embroidered Cotton Shirt,$895,Shirts
22,The Row,Johnny Suede Shirt Jacket,"$4,650",Shirts
23,John Varvatos Star U.S.A.,Flint Dot-Print Cotton Shirt,$98,Shirts
24,John Varvatos Star U.S.A.,Ashten Plaid Cotton Shirt,$148,Shirts
25,Barneys New York,Cotton Poplin Shirt,$295,Shirts
26,Comme des Garçons SHIRT,Embroidered-Face Silky Twill Short-Sleeve Shirt,$625,Shirts
27,John Varvatos Star U.S.A.,Marshall Selvedge Denim Shirt,$198,Shirts
28,John Varvatos Star U.S.A.,Darren Selvedge-Denim Work Shirt,$228,Shirts
29,John Elliott,Floral Twill Bowling Shirt,$358,Shirts
30,Kiton,Dot-Embroidered Chambray Shirt,$595,Shirts
31,John Varvatos Star U.S.A.,Trent Fil Coupé Cotton Shirt,$148,Shirts
32,Kiton,Washed Cotton Poplin Shirt,$595,Shirts
33,Double Rainbouu,Palm-Tree-Print Cotton Camp Shirt,$190,Shirts
34,Officine Générale,Botanical-Print Cotton Short-Sleeve Shirt,$275,Shirts
35,Comme des Garçons SHIRT,Striped Shirt,$315,Shirts
36,Luciano Barbera,Brushed Cotton-Wool Piqué Shirt Jacket,$395,Shirts
37,Barneys New York,Cotton Gingham Shirt,$295,Shirts
38,Barneys New York,Checked Cotton Flannel Shirt,$295,Shirts
39,Hartford,Bandana-Print Cotton Button-Down Shirt,$240,Shirts
40,Alex Mill,Plaid Cotton Flannel Shirt,$110,Shirts
41,Barba,Cotton Oxford Shirt,$350,Shirts
42,Officine Générale,Cotton Chambray Banded-Collar Shirt,$320,Shirts
43,Barneys New York,Cotton Poplin Shirt,$295,Shirts
44,Saint Laurent,Embellished Striped Silk Voile Shirt,"$2,290",Shirts
45,Double Rainbouu,Tiger-&-Palm-Leaf Cotton Button-Front Shirt,$170,Shirts
46,Gucci,Tonal-Striped Tieneck Shirt,$850,Shirts
47,Hartford,Cotton Corduroy Shirt,$225,Shirts
48,Kiton,Cotton Piqué-Knit Shirt,$595,Shirts
49,Double Rainbouu,"""Synthetic Leisure""-Print Cotton Camp Shirt",$190,Shirts
50,LOST DAZE,Multi-Hawaiian-Print Satin Shirt,$750,Shirts
51,Haider Ackermann,Plaid Washed Silky Twill Oversized Shirt,"$1,332",Shirts
52,Jil Sander,Photo-Print Shirt,$890,Shirts
53,Ralph Lauren Purple Label,Slub Linen Shirt,$450,Shirts
54,Barba,Plaid Linen Shirt,$350,Shirts
55,Barneys New York,Cotton Poplin Shirt,$295,Shirts
56,Fioroni,Cotton Jersey Slim Shirt,$450,Shirts
57,424,Colorblocked Canvas & Denim Oversized Work Shirt,$585,Shirts
58,Filling Pieces,Logo Plaid Camp Shirt,$330,Shirts
59,Balenciaga,Satin Shrunken Shirt,$850,Shirts
60,Kiton,Cotton Piqué Shirt,$595,Shirts
61,Balenciaga,Shrunken Shirt,$695,Shirts
62,Fioroni,Cotton Jersey Button-Front Shirt,$450,Shirts
63,Kenzo,Logo-Inset Cotton Oxford Shirt,$225,Shirts
64,Prabal Gurung,Floral-Jacquard Gauze Shirt,$995,Shirts
65,Fioroni,Cotton Jersey Slim Shirt,$450,Shirts
66,Kiton,Cotton Piqué Shirt,$595,Shirts
67,Theory,Sylvain Cotton Poplin Shirt,$175,Shirts
68,Ermenegildo Zegna,Checked Cotton End-On-End Shirt,$395,Shirts
69,Barneys New York,Cherry-Motif Cotton Short-Sleeve Shirt,$165,Shirts
70,Isaia,Checked Cotton Poplin Dress Shirt,$495,Shirts
71,Sartorio,Pinstriped Cotton Button-Down Dress Shirt,$395,Shirts
72,Brioni,Checked Cotton Poplin Dress Shirt,$650,Shirts
73,Prada,Cotton-Blend Slim Shirt,$510,Shirts
74,Jil Sander,Bowling Shirt,$550,Shirts
75,Ermenegildo Zegna,Checked Cotton Dress Shirt,$395,Shirts
76,Barneys New York,Cotton Broadcloth Trim Shirt,$245 - $255,Shirts
77,Givenchy,Signature-Embroidered Cotton Shirt,$500,Shirts
78,Ermenegildo Zegna,Cotton Dress Shirt,$345,Shirts
79,Rag & Bone,Plaid Herringbone-Weave Cotton Button-Front Shirt,$225,Shirts
80,Saint Laurent,Metallic Striped Linen-Cotton Shirt,$990,Shirts
81,Cifonelli,Cotton Pinpoint Oxford Cloth Dress Shirt,$425,Shirts
82,Ermenegildo Zegna,Cotton Twill Dress Shirt,$495,Shirts
83,Kiton,Pinstriped Cotton Dress Shirt,$695,Shirts
84,Prada,Stretch Cotton-Blend Poplin Shirt,$520,Shirts
85,Rag & Bone,Fit 3 Denim Button-Down Shirt,$275,Shirts
86,Barneys New York,Checked Cotton Dress Shirt,$265,Shirts
87,Barneys New York,Cotton Poplin Dress Shirt,$245 - $255,Shirts
88,Fairfax,Micro-Houndstooth Cotton Dress Shirt,$295,Shirts
89,Hartford,Cotton Chambray Shirt,$210,Shirts
90,Sartorio,Cotton Button-Down Dress Shirt,$395,Shirts
91,Isaia,Striped Cotton Dress Shirt,$495,Shirts
92,Hartford,Slub Linen Shirt,$210,Shirts
93,Cifonelli,Cotton Pinpoint Oxford Cloth Dress Shirt,$425,Shirts
94,Ermenegildo Zegna,Slub Linen Shirt,$345,Shirts
95,Ermenegildo Zegna,Traveller Plaid Cotton Twill Shirt,$395,Shirts
96,Hartford,Cotton Voile Shirt,$210,Shirts
97,Alexander McQueen,Contrast-Tipped Cotton Poplin Slim Shirt,$560,Shirts
98,Givenchy,Star-Embroidered Cotton Shirt,$640,Shirts
99,Fairfax,Striped Cotton Poplin Dress Shirt,$295,Shirts
100,Hartford,Cotton Voile Shirt,$210,Shirts
101,Isaia,Slim-Fit Cotton Dress Shirt,$395,Shirts
102,Ermenegildo Zegna,Textured Cotton Shirt,$395,Shirts
103,Barneys New York,Pin-Dot Cotton Dress Shirt,$265,Shirts
104,Barneys New York,Hairline Piqué Tuxedo Shirt,$295,Shirts
105,Isaia,Grid Checked Cotton Poplin Dress Shirt,$495,Shirts
106,Ermenegildo Zegna,Cotton Poplin Dress Shirt,$395,Shirts
107,Barneys New York,End-On-End Shirt,$245 - $255,Shirts
108,Ermenegildo Zegna,Striped Cotton Poplin Dress Shirt,$395,Shirts
109,Thom Browne,Tricolor-Cuff Cotton Oxford Cloth Button-Down Shirt,$350,Shirts
110,Ermenegildo Zegna,Chambray Dress Shirt,$395,Shirts
111,Barneys New York,Checked Cotton Poplin Button-Down Shirt,$195,Shirts
112,Saint Laurent,Denim Shirt,$950,Shirts
113,Kenzo,Tiger-Embroidered Cotton Shirt,$250,Shirts
114,Drake's,Piqué Dress Shirt,$350,Shirts
115,Barneys New York,Striped Cotton Poplin Dress Shirt,$265,Shirts
116,Prada,Cotton-Blend Poplin Shirt,$510,Shirts
117,Barneys New York,Gingham Cotton Poplin Dress Shirt,$265,Shirts
118,Isaia,Striped Cotton Poplin Shirt,$395,Shirts
119,Barneys New York,Houndstooth Cotton Shirt,$265,Shirts
120,Ermenegildo Zegna,Checked Cotton Poplin Dress Shirt,$395,Shirts
121,Prada,Geometric Cotton Bowling Shirt,$750,Shirts
122,Paul Smith,Cotton-Blend Poplin Dress Shirt,$250,Shirts
123,Jil Sander,Bowling Shirt,$670,Shirts
124,Prada,Cotton-Blend Slim Shirt,$510,Shirts
125,Barneys New York,Cotton Poplin Dress Shirt,$265,Shirts
126,Prada,Stretch Cotton-Blend Poplin Slim Shirt,$520,Shirts
127,Officine Générale,Plain-Weave Short-Sleeve Henley,$295,Shirts
128,Isaia,Cotton Poplin Shirt,$395,Shirts
129,Finamore,Striped Cotton Poplin Dress Shirt,$425,Shirts
130,Thom Browne,Swimmer-Print Cotton Poplin Short-Sleeve Shirt,$590,Shirts
131,Hartford,Striped Linen Button-Down Shirt,$210,Shirts
132,Gucci,Kingsnake-Embroidered Cotton Poplin Shirt,$620,Shirts
133,Kiton,Striped Cotton Dress Shirt,$595,Shirts
134,Ermenegildo Zegna,Textured Cotton Shirt,$395,Shirts
135,Fairfax,Cotton Poplin Tuxedo Shirt,$450,Shirts
136,Prada,Cotton-Blend Poplin Shirt,$520,Shirts
137,Barneys New York,Checked Cotton Dress Shirt,$265,Shirts
138,Ermenegildo Zegna,Checked Trofeo® Cotton Dress Shirt,$395,Shirts
139,RRL,Lee Ranch-Print Cotton Work Shirt,$350,Shirts
140,Uman,Poplin Dress Shirt,$360,Shirts
141,Isaia,Cotton Oxford Dress Shirt,$495,Shirts
142,Vetements,"""God Save Us"" Cotton Denim Button-Front Shirt",$990,Shirts
143,Sartorio,Cotton Button-Down Dress Shirt,$395,Shirts
144,Barneys New York,Striped Cotton Poplin Dress Shirt,$265,Shirts
145,Ermenegildo Zegna,Plaid Micro-Herringbone Cotton Dress Shirt,$395,Shirts
146,Ermenegildo Zegna,Striped Cotton Poplin Dress Shirt,$395,Shirts
147,Boglioli,Cotton Button-Down Dress Shirt,$295,Shirts
148,Uman,Checked Cotton Poplin Dress Shirt,$395,Shirts
149,Brioni,Striped Cotton Poplin Dress Shirt,$520,Shirts
150,Isaia,Denim-Look Cotton Dress Shirt,$695,Shirts
151,Fairfax,Cotton Oxford Cloth Dress Shirt,$295,Shirts
152,Barneys New York,Cotton End-On-End Trim Shirt,$245 - $255,Shirts
153,Barba,Slub Linen Shirt,$350,Shirts
154,Brioni,Striped Cotton Poplin Dress Shirt,$650,Shirts
155,Isaia,Cotton Poplin Shirt,$395,Shirts
156,Isaia,Micro-Checked Cotton Shirt,$395,Shirts
157,Gucci,Logo-Detailed Silky Twill Bowling Shirt,"$1,200",Shirts
158,Ermenegildo Zegna,Trofeo Cotton Twill Dress Shirt,$415,Shirts
159,Barneys New York,Tonal-Striped Dress Shirt,$265,Shirts
160,Off-White c/o Virgil Abloh,Plaid-Flannel-Detailed Denim Western Shirt,$765,Shirts
161,Brioni,Cotton Chambray Dress Shirt,$550,Shirts
162,Barneys New York,Cotton Poplin Dress Shirt,$265,Shirts
163,Rag & Bone,Tomlin Fit 2 Checked Cotton Button-Down Shirt,$225,Shirts
164,Cifonelli,Checked Cotton Poplin Dress Shirt,$425,Shirts
165,Barneys New York,Checked Cotton Poplin Shirt,$265,Shirts
166,Ermenegildo Zegna,Trofeo Cotton Twill Dress Shirt,$395,Shirts
167,Sartorio,Striped Cotton Button-Down Dress Shirt,$395,Shirts
168,Loro Piana,Aloe-Treated Slub Linen Shirt,$515,Shirts
169,Sartorio,Cotton Button-Down Dress Shirt,$395,Shirts
170,Brioni,Striped-Bib Cotton Voile Tuxedo Shirt,$750,Shirts
171,Barneys New York,Herringbone Cotton Shirt,$265,Shirts
172,Barneys New York,Cotton Poplin Trim Dress Shirt,$245,Shirts
173,Thom Browne,Tricolor-Band Cotton Oxford Cloth Button-Down Shirt,$450,Shirts
174,Barneys New York,Floral Camp Shirt,$165,Shirts
175,Prada,Cotton-Blend Poplin Slim Shirt,$510,Shirts
176,Finamore,Dress Shirt,$425,Shirts
177,Saint Laurent,Star-Print Cotton Voile Shirt,$990,Shirts
178,Barneys New York,Cotton Poplin Dress Shirt,$265,Shirts
179,Hartford,Cotton Corduroy Button-Down Shirt,$235,Shirts
180,Lanvin,Cotton Poplin Shirt,$395,Shirts
181,Hartford,Cotton Voile Shirt,$210,Shirts
182,Brooklyn Tailors,End-On-End Cotton Shirt,$185,Shirts
183,Hartford,Cotton Voile Shirt,$210,Shirts
184,Barneys New York,Cotton Faille Dress Shirt,$265,Shirts
185,Cifonelli,Checked Cotton Poplin Dress Shirt,$425,Shirts
186,Isaia,Plaid Cotton Poplin Dress Shirt,$480,Shirts
187,Barneys New York,Trim-Fit Shirt,$245,Shirts
188,AMI Alexandre Mattiussi,Smiley-Patch Cotton Oxford Shirt,$235,Shirts
189,Uman,Striped Cotton Poplin Dress Shirt,$395,Shirts
190,Boglioli,Cotton Button-Down Dress Shirt,$295,Shirts
191,Gucci,Embroidered Oxford Cotton Shirt,$780,Shirts
192,Ermenegildo Zegna,Checked Cotton-Linen Dress Shirt,$395,Shirts
193,Isaia,Cotton Voile Dress Shirt,$495,Shirts
194,Isaia,Checked Cotton Poplin Dress Shirt,$495,Shirts
195,Barneys New York,Piqué Trim-Fit Shirt,$295,Shirts
196,Brioni,Checked Cotton Poplin Dress Shirt,$650,Shirts
197,Brioni,Striped Cotton Poplin Dress Shirt,$630,Shirts
198,Sartorio,Cotton Chambray Button-Down Dress Shirt,$395,Shirts
199,Barneys New York,Cotton Twill Dress Shirt,$265,Shirts
200,Ermenegildo Zegna,Puppytooth Cotton Poplin Dress Shirt,$395,Shirts
201,Ermenegildo Zegna,Piqué Bib Shirt,$545,Shirts
202,Barneys New York,Cotton-Blend Poplin Dress Shirt,$265,Shirts
203,Isaia,Piqué Shirt,$495,Shirts
204,Givenchy,Logo-Trimmed Cotton Shirt,$780,Shirts
205,Barneys New York,Striped Cotton Poplin Shirt,$265,Shirts
206,Saint Laurent,Scarf-Print Silk Bowling Shirt,$990,Shirts
207,Ermenegildo Zegna,Micro-Checked Cotton Dress Shirt,$495,Shirts
208,Saint Laurent,Plaid Cotton Flannel Shirt,$690,Shirts
209,Isaia,Dobby-Weave Cotton Dress Shirt,$495,Shirts
210,Ermenegildo Zegna,Cotton Twill Dress Shirt,$395,Shirts
211,Finamore,Checked Cotton Dress Shirt,$450,Shirts
212,Kiton,Checked Cotton Dress Shirt,$695,Shirts
213,Off-White c/o Virgil Abloh,Checked Cotton-Blend Flannel Shirt,$655,Shirts
214,Saint Laurent,Plaid Flannel Western Shirt,$750,Shirts
215,Brioni,Cotton Poplin Button-Front Shirt,$590,Shirts
216,Hartford,Slub Linen Shirt,$210,Shirts
217,Uman,Pinpoint Oxford Cloth Dress Shirt,$490,Shirts
218,Alexander McQueen,Embellished Cotton Poplin Shirt,$695,Shirts
219,Barneys New York,Checked Cotton Poplin Shirt,$265,Shirts
220,Uman,Striped Cotton Poplin Dress Shirt,$475,Shirts
221,Brooklyn Tailors,Cotton Poplin Shirt,$185,Shirts
222,Brioni,Gingham Cotton Poplin Dress Shirt,$550,Shirts
223,Brioni,Poplin Dress Shirt,$575,Shirts
224,Saint Laurent,Embroidered Velvet Western Shirt,"$1,290",Shirts
225,Brioni,Poplin Dress Shirt,$575,Shirts
226,Barneys New York,Cotton Poplin Dress Shirt,$265,Shirts
227,RRL,Patchwork Cotton Shirt,$595,Shirts
228,Marni,Oversized Baseball Shirt,$885,Shirts
229,Just Don,Metallic-Striped Tech-Jersey Shooting Shirt,$650,Shirts
230,Needles,Geometric-Print Silky Twill Shirt,$515,Shirts
231,OAMC,Grafitti-Logo Pinstriped Cotton Oversized Shirt,$455,Shirts
232,KATHARINE HAMNETT LONDON,Nicola Silk Shirt,$380,Shirts
233,Barena Venezia,Hibiscus-Print Plain-Weave Popover Shirt,$335,Shirts
234,Barena Venezia,Multi-Pocket Linen-Cotton Gauze Shirt,$480,Shirts
235,Comme des Garçons SHIRT,Cutout-Face Button-Front Long Shirt,$485,Shirts
236,John Varvatos,Floral Cotton Jacquard Shirt,$248,Shirts
237,Barena Venezia,Cotton Piqué Short-Sleeve Shirt,$285,Shirts
238,Onia,Vacation Cactus-Embroidered Camp-Collar Shirt,$130,Shirts
239,PS by Paul Smith,Palm-Tree Cotton Two-Button Sportcoat,$650,Shirts
240,Comme des Garçons SHIRT,X Striped End-On-End Cotton Snap-Front Shirt,$995,Shirts
241,Y/Project,Bandana-Flag Cotton Oversized Shirt,$775,Shirts
242,Martine Rose,Oversized Graphic Shirt,$855,Shirts
243,Barneys New York,Gingham Cotton Flannel Shirt,$295,Shirts
244,KATHARINE HAMNETT LONDON,"""Beach"" Silk Shirt",$355,Shirts
245,John Varvatos,Checked Cotton Voile Shirt,$198,Shirts
246,John Varvatos,Patina-Print Cotton Shirt,$188,Shirts
247,CMMN SWDN,Logo Striped Silk Organza Shirt,$440,Shirts
248,Barena Venezia,Venice-Motif Linen Shirt,$305,Shirts
249,Sacai,Embroidered Patchwork Denim Shirt,$985,Shirts
250,Barena Venezia,Colorblocked-Striped Linen Button-Front Shirt,$235,Shirts
251,Rick Owens,Slub Taffeta Workshirt,$800,Shirts
252,Ovadia & Sons,Beer-Print Camp-Collar Shirt,$270,Shirts
253,LOEWE,Bandana-Patchwork Cotton Poplin Asymmetric Shirt,"$1,550",Shirts
254,Prada,Circle Cotton Poplin Shirt,$780,Shirts
255,Luciano Barbera,Striped Cotton Poplin Shirt,$295,Shirts
256,AMI Alexandre Mattiussi,Appliquéd Cotton Oxford Shirt,$260,Shirts
257,PS by Paul Smith,Palm-Print Cotton Camp-Collar Shirt,$175,Shirts
258,Acne Studios,Simon Pine Camp Shirt,$350,Shirts
259,Fairfax,Checked Cotton Poplin Dress Shirt,$295,Shirts
260,Balenciaga,"""I Love Techno"" Striped Cotton Shirt","$1,090",Shirts
261,Balenciaga,Casino-Print Oversized Shirt,"$1,090",Shirts
262,Uman,Tonal-Striped Shirt,$475,Shirts
263,LOEWE,Eyelet-Embroidered Linen Shirt,"$1,790",Shirts
264,Ksubi,Floral-Print Twill Shirt,$160,Shirts
265,Barena Venezia,Watercolor-Floral Cotton Voile Popover Shirt,$295,Shirts
266,PS by Paul Smith,Palm-Print Cotton Poplin Shirt,$175,Shirts
267,Vetements,Paisley & Sticker-Print Cotton Oversized Shirt,"$1,110",Shirts
268,Fairfax,Cotton Poplin Dress Shirt,$295,Shirts
269,Massimo Alba,Brushed Cotton Shirt,$325,Shirts
270,Hartford,Cotton Chambray Shirt,$215,Shirts
271,Acne Studios,Isherwood Rustic Plaid Cotton Shirt,$290,Shirts
272,J.W.Anderson,Durer Scene Striped End-On-End Cotton Shirt,$650,Shirts
273,Ralph Lauren Purple Label,Plaid Cotton & Linen Shirt,$495,Shirts
274,Gucci,Cotton Oxford Cloth Shirt,$660,Shirts
275,Massimo Alba,Brushed Cotton Shirt,$325,Shirts
276,Greg Lauren,Plaid Cotton Flannel Studio Shirt,$715,Shirts
277,CALVIN KLEIN 205W39NYC,Contrast-Trimmed Wool Shirt,$950,Shirts
278,Barena Venezia,Pinstriped Cotton Plain-Weave Longline Shirt,$295,Shirts
279,Eidos,Solid Cotton Poplin Shirt,$250,Shirts
280,Burberry,Gorilla-Print Cotton Half-Zip Shirt,$620,Shirts
281,Giorgio Armani,Military-Style Camp-Collar Shirt,$945,Shirts
282,Balenciaga,Logo-Back Crisp Shirt,"$1,290",Shirts
283,Ermenegildo Zegna,Cotton Poplin Shirt,$375,Shirts
284,Maison Margiela,Padded Cotton Poplin Military Shirt,$790,Shirts
285,Jil Sander,Patch-Pocket Cotton Poplin Shirt,$470,Shirts
286,Ovadia & Sons,Betty Boop-Print Striped Cotton Shirt,$270,Shirts
287,CMMN SWDN,Vertical-Striped Open-Knit Cotton Short-Sleeve Shirt,$340,Shirts
288,Fairfax,Plaid Cotton Poplin Dress Shirt,$295,Shirts
289,Brioni,Checked Cotton Poplin Dress Shirt,$520,Shirts
290,Givenchy,Colorblocked Military Shirt,"$1,190",Shirts
291,Alex Mill,Striped Cotton Four-Button Popover Shirt,$98,Shirts
292,Martin Grant,Cotton Poplin Tunic,"$1,325",Shirts
293,Ermenegildo Zegna,Checked Trofeo® Cotton Dress Shirt,$395,Shirts
294,Z Zegna,Solid Poplin Shirt,$245,Shirts
295,VisVim,Elbow-Patch Cotton Shirt,$775,Shirts
296,Ermenegildo Zegna,Checked Cotton Poplin Dress Shirt,$495,Shirts
297,Paul Smith,Floral Cotton Poplin Shirt,$295,Shirts
298,Givenchy,Dragon-Sky-Print Silk Bowling Shirt,"$1,120",Shirts
299,Cifonelli,Gingham Cotton-Linen Shirt,$450,Shirts
300,Lanvin,Shark-Head-Pattern Plain-Weave Bowling Shirt,$695,Shirts
301,Eleventy,Basket-Weave Cotton Button-Front Shirt,$345,Shirts
302,The Row,Ahmet Cotton Poplin Shirt,$850,Shirts
303,Cifonelli,Cotton End-On-End Shirt,$450,Shirts
304,Ermenegildo Zegna,Linen Dress Shirt,$345,Shirts
305,Lanvin,Cotton-Blend Lamé Button-Front Shirt,$795,Shirts
306,Sies Marjan,City-Print Crepe Shirt,$695,Shirts
307,Gucci,Panther-Patch Gingham Linen Shirt,"$1,590",Shirts
308,PS by Paul Smith,Cotton Poplin Shirt,$195,Shirts
309,Cifonelli,Cotton Poplin Dress Shirt,$425,Shirts
310,Paul Smith,Explorer-Print Cotton Slim Shirt,$295,Shirts
311,Hartford,Penn Pat Cotton Shirt,$235,Shirts
312,Jil Sander,Wool-Mohair Overshirt,$690,Shirts
313,J.W.Anderson,"""Dog Boy"" Cotton Tunic Shirt",$560,Shirts
314,Finamore,Glen Plaid Cotton Dress Shirt,$425,Shirts
315,Thom Browne,Appliquéd Cotton Button-Down Shirt,$450,Shirts
316,Loro Piana,Aloe-Treated Slub Linen Shirt,$515,Shirts
317,Comme des Garçons SHIRT BOY,Logo-Print Cotton Shirt,$440,Shirts
318,Orlebar Brown,Ridley Linen Shirt,$225,Shirts
319,Ermenegildo Zegna,Traveller Checked Cotton Poplin Shirt,$395,Shirts
320,Comme des Garçons SHIRT BOY,Logo-Print Cotton Shirt,$415,Shirts
321,Lanvin,Encyclopedia-Print Silk Shirt,"$1,395",Shirts
322,Brioni,Checked Cotton Poplin Dress Shirt,$630,Shirts
323,PS by Paul Smith,Graphic Cotton Shirt,$175,Shirts
324,Needles,Leaf-Pattern Jacquard Western Shirt,$685,Shirts
325,Officine Générale,Striped Oxford Cloth Camp Shirt,$295,Shirts
326,Sies Marjan,Club-Kid-Print Silk Shirt,$795,Shirts
327,Gucci,Embroidered-Skull Washed Satin Shirt,"$1,100",Shirts
328,Thom Browne,Gingham Cotton Poplin Shirt,$550,Shirts
329,CALVIN KLEIN 205W39NYC,Reflective-Tape-Trimmed Denim Shirt Jacket,$790,Shirts
330,Saint Laurent,Playing Card Silk Shirt,$990,Shirts
331,Paul Smith,Floral Cotton Poplin Shirt,$250,Shirts
332,Barneys New York,Cotton Corduroy Shirt,$285,Shirts
333,Lanvin,Shark-Print Cotton Button-Down Shirt,$625,Shirts
334,Gucci,Interlocking-G-Print Cotton T-Shirt,$480,Shirts
335,Theory,Menlo Striped Cotton Shirt,$225,Shirts
336,Barneys New York,Checked Cotton Flannel Shirt,$285,Shirts
337,Cifonelli,Plaid Cotton Shirt,$450,Shirts
338,KATHARINE HAMNETT LONDON,Brendan Dot-Print Silk Shirt,$470,Shirts
339,Sartorio,Pinstriped Cotton Button-Down Dress Shirt,$395,Shirts
340,Eleventy,Textured Cotton Sport Shirt,$345,Shirts
341,AMIRI,Beverly Hills Twill Shirt,$890,Shirts
342,Sartorio,Checked Cotton Button-Down Dress Shirt,$395,Shirts
343,Sartorio,Checked Cotton Button-Down Shirt,$395,Shirts
344,Vetements,Marilyn Manson Cotton Oversized Shirt,$970,Shirts
345,R13,Multi-Sleeve Plaid Cotton Shirt,$450,Shirts
346,Cifonelli,Cotton-Linen Shirt,$450,Shirts
347,John Varvatos Star U.S.A.,Cotton Chambray Western Shirt,$188,Shirts
348,PS by Paul Smith,Cotton Poplin Shirt,$195,Shirts
349,Cifonelli,Cotton Button-Front Shirt,$750,Shirts
350,Ermenegildo Zegna,Slub Linen Shirt,$345,Shirts
351,Gucci,Ruffle Silk Shirt,$980,Shirts
352,RRL,Patchwork Cotton Flannel Workshirt,$595,Shirts
353,Massimo Alba,Dot-Print Cotton Shirt,$320,Shirts
354,Officine Générale,Square-Dot Cotton Poplin Henley,$365,Shirts
355,John Varvatos Star U.S.A.,Pinstriped Cotton Twill Button-Front Shirt,$98,Shirts
356,Boglioli,Washed Linen Shirt,$325,Shirts
357,Valentino,V-Print Cotton Poplin Bowling Shirt,$750,Shirts
358,Brioni,Plaid Cotton Poplin Shirt,$650,Shirts
359,Dries Van Noten,Handprint-Graphic Cotton Poplin Shirt,$550,Shirts
360,Officine Générale,Dario Dot-Print Camp-Collar Shirt,$350,Shirts
361,Loro Piana,Cotton Piqué Shirt,$715,Shirts
362,Cifonelli,Cotton Button-Front Shirt,$750,Shirts
363,Cifonelli,Cotton Poplin Dress Shirt,$425,Shirts
364,RRL,Plaid Cotton Shirt,$245,Shirts
365,Double Rainbouu,Cotton Twill Relaxed Shirt,$165,Shirts
366,Officine Générale,Puckered Cotton-Blend Shirt,$295,Shirts
367,Barneys New York,Gingham Cotton Shirt,$285,Shirts
368,John Varvatos Star U.S.A.,Geometric-Floral Cotton Poplin Short-Sleeve Shirt,$98,Shirts
369,Ermenegildo Zegna,Snorkel-Print Cotton Dress Shirt,$475,Shirts
370,Dries Van Noten,Striped Cotton Voile Shirt,$315,Shirts
371,Prada,Floral Tech-Satin Bowling Shirt,"$1,030",Shirts
372,Officine Générale,Nep Cotton Banded-Collar Shirt,$340,Shirts
373,Neil Barrett,Fringe-Trimmed Cotton Poplin Shirt,$490,Shirts
374,Orlebar Brown,Morton Linen Shirt,$245,Shirts
375,Brioni,Geometric-Jacquard Cotton Dress Shirt,$630,Shirts
376,Paul Smith,Floral Cotton Poplin Shirt,$295,Shirts
377,Balenciaga,Rose-Embroidered Denim Shirt,$950,Shirts
378,Saint Laurent,Striped Satin Shirt,"$1,190",Shirts
379,Raf Simons,Pierced-Man Mesh-Detailed Cotton Poplin Shirt,$990,Shirts
380,Barneys New York,Striped Cotton Oxford Cloth Button-Down Shirt,$195,Shirts
381,Barena Venezia,Cotton Poplin Longline Shirt,$275,Shirts
382,Brioni,Piqué Cotton Dress Shirt,$550,Shirts
383,Isabel Marant,Helynton Cotton Chambray Shirt,$430,Shirts
384,Off-White c/o Virgil Abloh,Dondi Cotton-Blend Uniform Shirt,$665,Shirts
385,Prada,Circle Cotton Poplin Shirt,$780,Shirts
386,Brioni,Cotton Dress Shirt,$520,Shirts
387,Loro Piana,Aloe-Treated Slub Linen Shirt,$515,Shirts
388,Saint Laurent,Paisley Silk Georgette Shirt,$990,Shirts
389,Comme des Garçons,Cutout Cotton Poplin Shirt,$400,Shirts
390,Alex Mill,Plaid Double-Faced Cotton Shirt,$110,Shirts
391,Hartford,Garment-Dyed Cotton Moleskin Shirt,$265,Shirts
392,Z Zegna,Solid Poplin Shirt,$245,Shirts
393,Rag & Bone,Tomlin Cotton-Linen Flannel Shirt,$250,Shirts
394,Givenchy,Mixed-Print Silk Twill Shirt,"$1,120",Shirts
395,Gucci,Poppy-Print Silk Button-Down Shirt,"$1,400",Shirts
396,Barneys New York,Slub Cotton-Linen Button-Down Shirt,$195,Shirts
397,Gucci,Striped Cotton Poplin Tunic,$780,Shirts
398,Isaia,Pinstriped Cotton Shirt,$650,Shirts
399,James Perse,Palm-Leaf-Print Cotton Camp Shirt,$295,Shirts
400,Isaia,Striped Cotton Dress Shirt,$495,Shirts
401,Off-White c/o Virgil Abloh,Logo Checked Cotton-Blend Flannel Shirt,$645,Shirts
402,Givenchy,Monster-Print Cotton Bowling Shirt,$500,Shirts
403,Paul Smith,Cotton-Blend Poplin Dress Shirt,$250,Shirts
404,Cifonelli,Checked Cotton Poplin Dress Shirt,$425,Shirts
405,Rick Owens,Plaid Cotton Flannel Sleeveless Overshirt,"$1,400",Shirts
406,PS by Paul Smith,Fox-Print Cotton Poplin Shirt,$195,Shirts
407,Onia,Vacation Shapes-&-Stripes Plain-Weave Shirt,$145,Shirts
408,Dries Van Noten,Striped Cotton Poplin Shirt,$450,Shirts
409,Ermenegildo Zegna,Cotton Poplin Shirt,$375,Shirts
410,Onia,Constellation-Print Cotton Poplin Short-Sleeve Shirt,$195,Shirts
411,Lanvin,Striped Merino Wool Shirt,"$1,295",Shirts
412,Jil Sander,Striped Shirt,$590,Shirts
413,Uman,Cotton Poplin Dress Shirt,$395,Shirts
414,Massimo Alba,Cotton Seersucker Shirt,$325,Shirts
415,Theory,Menlo Plaid Cotton Flannel Shirt,$245,Shirts
416,RtA,Shiny Twill Shirt,$275,Shirts
417,Neil Barrett,Lightning-Bolt-Print Cotton Shirt,$535,Shirts
418,Ralph Lauren Purple Label,Cotton Poplin Dress Shirt,$495,Shirts
419,HECHO,Art-Print Cotton Poplin Shirt,$375,Shirts
420,Fairfax,Plaid Cotton Poplin Dress Shirt,$295,Shirts
421,Greg Lauren,Plaid Cotton Flannel Studio Shirt,$715,Shirts
422,Kiton,Checked Cotton Dress Shirt,$595,Shirts
423,Givenchy,Kaleidoscope-Daisy Crêpe De Chine Shirt,"$1,420",Shirts
424,Sartorio,Checked Cotton Button-Down Shirt,$395,Shirts
425,Boglioli,Checked Cotton Dress Shirt,$375,Shirts
426,Saturdays NYC,Fan-Print Twill Camp Shirt,$185,Shirts
427,Saturdays NYC,Nautical-Print Twill Camp Shirt,$185,Shirts
428,R13,Tattered-Hem Cotton Plaid Shirt,$450,Shirts
429,Fairfax,Checked Cotton Poplin Dress Shirt,$295,Shirts
430,Prada,Cotton-Blend Slim Shirt,$510,Shirts
431,Double Rainbouu,Abstract-Floral Cotton Voile Shirt,$190,Shirts
432,Boglioli,Houndstooth Cotton Shirt,$315,Shirts
433,Ermenegildo Zegna,Striped Cotton Poplin Dress Shirt,$415,Shirts
434,Ermenegildo Zegna,Star-Print Cotton Dress Shirt,$475,Shirts
435,Comme des Garçons SHIRT BOY,Logo-Print Cotton Shirt,$440,Shirts
436,Hartford,Moleskin Cotton Shirt,$265,Shirts
437,Lanvin,Satin Crop Western Shirt,$925,Shirts
438,Ksubi,Palm-Tree Shirt,$160,Shirts
439,Theory,Sylvain Shirt,$195,Shirts
440,Fairfax,Cotton Oxford Dress Shirt,$295,Shirts
441,P. Johnson,Birdseye Cotton Tuxedo Shirt,$325,Shirts
442,Eidos,Striped Cotton-Linen Shirt,$250,Shirts
443,Barneys New York,Tropical-Floral Cotton Short-Sleeve Shirt,$165,Shirts
444,Ermenegildo Zegna,Cotton-Linen Dress Shirt,$395,Shirts
445,Theory,Sylvain Cotton-Blend Shirt,$195,Shirts
446,Isaia,Cotton Piqué Shirt,$350,Shirts
